{
  "schema_version": "1.0",
  "bundle_id": "bundle_001",
  "version": "0.2.0",
  "policy_hash": "sha256:abc",
  "environment": "dev",
  "created_at": "2026-06-28T00:00:00Z",
  "signer_identity": "policy-admin",
  "signature": null,
  "compatibility": {
    "gateway": ">=0.3.0 <0.4.0",
    "schemas": [
      "1.0"
    ],
    "wrappers": [
      "credential:1.0",
      "approval:1.0"
    ],
    "api": "1.0"
  },
  "contents": [
    {
      "path": "gateway_policy.yaml",
      "sha256": "sha256:def"
    },
    {
      "path": "risk_matrix.yaml",
      "sha256": "sha256:ghi"
    }
  ]
}
